Position,Titre SERP,URL,Meta title,Meta description,Snippet,Domaine,Mot clé
1,Centre Québécois de programmation neuro linguistique à ...,https://centrepnl.com/,Centre Québécois de programmation neuro linguistique à Montréal,"Centre de programmation neuro linguistique CQPNL, formations certifiantes pour les individus, organisations et coachs, à Montréal.","Centre de programmation neuro linguistique CQPNL, formations certifiantes pour les individus, organisations et coachs, à Montréal.",centrepnl.com,coaching pnl
2,Praticien(ne) certifié(e) en PNL,https://coaching-quebec.com/formations/praticien-pnl/,Praticien(ne) certifié(e) en PNL – Coaching Québec,La formation de Praticien(ne) en PNL vous permettra de développer et d’intégrer de manière approfondie les modèles de communication et de changement proposés par la Programmation neurolinguistique. Proposée en classe et en ligne.,La formation de Praticien(ne) en PNL vous permettra de développer et d'intégrer de manière approfondie les modèles de communication et de changement ...,coaching-quebec.com,coaching pnl
3,Canada Coaching| Formation PNL et Hypnose en ligne| Québec,https://canadacoaching.ca/,Canada Coaching| Formation PNL et Hypnose en ligne| Québec,"Canada Coaching à Quebec, Formation PNL et Hypnose en ligne(base PNL, Praticien, Maitre praticien, Coach PNL) formation certifiante en ligne.","Canada Coaching a pour mission d'inspirer et d'accompagner toute personne souhaitant développer son plein potentiel, tant sur le plan personnel que ...",canadacoaching.ca,coaching pnl
4,Formations en Coaching et PNL en ligne - École accréditée,https://humanitum.ca/,Formations en Coaching et PNL en ligne - École accréditée,"Devenez coach de vie professionnel. École PNL (base, praticien, maître praticien). Formations en ligne certifiées et reçus d'impôts. Constellation familiale Montréal.","Devenez coach de vie professionnel. École PNL (base, praticien, maître praticien). Formations en ligne certifiées et reçus d'impôts.",humanitum.ca,coaching pnl
6,COACHING PNL,http://www.cpoptimale.ca/coaching-pnl/,COACHING PNL | CLINIQUE PSYCHO-OPTIMALE | CLINIQUE PSYCHO-OPTIMALE,"Le coaching est un accompagnement utile si vous avez de la difficulté à déterminer ou atteindre un objectif, si vous désirez surmonter un obstacle ou modifier un comportement qui vous freine, si vous désirez mieux vous connaître et vous épanouir ou si vous désirez réaliser votre rêve mais ne savez pas par où commencer. L’approche","Le coaching est un accompagnement utile si vous avez de la difficulté à déterminer ou atteindre un objectif, si vous désirez surmonter un obstacle ou ...",cpoptimale.ca,coaching pnl
