Position,Titre SERP,URL,Meta title,Meta description,Snippet,Domaine,Mot clé
1,Centre Québécois de programmation neuro ... - Montréal,https://centrepnl.com/,Centre Québécois de programmation neuro linguistique à Montréal,"Centre de programmation neuro linguistique CQPNL, formations certifiantes pour les individus, organisations et coachs, à Montréal.","De la formation de base à celle d'enseignant, découvrez l'ensemble du parcours en PNL. Toutes nos formations sont en direct (en présentiel ou en ligne). En ...",centrepnl.com,formation pnl
2,Formation de base en programmation neuro-linguistique,https://canadacoaching.ca/product/formation-de-base-en-pnl-en-ligne/,Formation de base en PNL en ligne | Canada Coaching,Formation de Base en PNL en Ligne Découvrez les bases de la Programmation Neuro-Linguistique (PNL) grâce à une formation en ligne...,"Canada Coaching vous propose une formation certifiante en PNL à distance, garantissant un enseignement de qualité dans un cadre privilégié qui favorise l' ...",canadacoaching.ca,formation pnl
3,Praticien(ne) certifié(e) en PNL,https://coaching-quebec.com/formations/praticien-pnl/,Praticien(ne) certifié(e) en PNL – Coaching Québec,La formation de Praticien(ne) en PNL vous permettra de développer et d’intégrer de manière approfondie les modèles de communication et de changement proposés par la Programmation neurolinguistique. Proposée en classe et en ligne.,La formation de Praticien(ne) en PNL vous permettra de développer et d'intégrer de manière approfondie les modèles de communication et de changement ...,coaching-quebec.com,formation pnl
5,Formations en Coaching et PNL en ligne - École accréditée,https://humanitum.ca/,Formations en Coaching et PNL en ligne - École accréditée,"Devenez coach de vie professionnel. École PNL (base, praticien, maître praticien). Formations en ligne certifiées et reçus d'impôts. Constellation familiale Montréal.","Devenez coach de vie professionnel. École PNL (base, praticien, maître praticien). Formations en ligne certifiées et reçus d'impôts.",humanitum.ca,formation pnl
8,S'initier à la prgrammation neurolinguistique (PNL) - Cégep,https://www.lecegep.ca/fr/formations/sinitier-a-la-prgrammation-neurolinguistique-pnl,S'initier à la prgrammation neurolinguistique (PNL) | Cégep,"À la fin de la formation, les participants auront découvert les différents styles de communication et leurs composantes afin de mieux se synchroniser avec…",Découvrir les fondements et l'historique de la PNL. • Mettre à jour les différents niveaux et structures de langage. • L'intention porteuse de communication.,lecegep.ca,formation pnl
