Position,Titre SERP,URL,Meta title,Meta description,Snippet,Domaine,Mot clé
1,Centre Québécois de programmation neuro linguistique à ...,https://centrepnl.com/,Centre Québécois de programmation neuro linguistique à Montréal,"Centre de programmation neuro linguistique CQPNL, formations certifiantes pour les individus, organisations et coachs, à Montréal.","Centre de programmation neuro linguistique CQPNL, formations certifiantes pour les individus, organisations et coachs, à Montréal.",centrepnl.com,pnl coaching
2,Canada Coaching| Formation PNL et Hypnose en ligne| Québec,https://canadacoaching.ca/,Canada Coaching| Formation PNL et Hypnose en ligne| Québec,"Canada Coaching à Quebec, Formation PNL et Hypnose en ligne(base PNL, Praticien, Maitre praticien, Coach PNL) formation certifiante en ligne.","Canada Coaching a pour mission d'inspirer et d'accompagner toute personne souhaitant développer son plein potentiel, tant sur le plan personnel que ...",canadacoaching.ca,pnl coaching
3,Praticien(ne) certifié(e) en PNL,https://coaching-quebec.com/formations/praticien-pnl/,Praticien(ne) certifié(e) en PNL – Coaching Québec,La formation de Praticien(ne) en PNL vous permettra de développer et d’intégrer de manière approfondie les modèles de communication et de changement proposés par la Programmation neurolinguistique. Proposée en classe et en ligne.,La formation de Praticien(ne) en PNL vous permettra de développer et d'intégrer de manière approfondie les modèles de communication et de changement ...,coaching-quebec.com,pnl coaching
5,Coaching PNL - Coach de Vie certifiée et NeuroSciences ...,https://coaching-pnl.ca/,Coaching PNL - Coach de Vie certifiée et NeuroSciences appliquées,Vous cherchez un coach de vie pour vous aider à atteindre vos objectifs? Contactez Danye Langlois coach Professionnelle PNL et Neurosciences.,Le coaching en PNL est une approche orientée vers les objectifs et centrée sur les forces positives du client. L'appellation programmation neuro linguistique ...,coaching-pnl.ca,pnl coaching
6,Société internationale des coachs PNL | Solutions ...,https://sicpnl.org/,Société internationale des coachs PNL | Solutions Intelligences Coaching Professionnel Neurosciences Leadership | Société internationale des coachs PNL,"COACHS PROFESSIONNELS CERTIFIÉS | 1000 heures et plus de formation pour vous accompagner et réaliser vos défis, ambitions et aspirations","COACHS PROFESSIONNELS CERTIFIÉS | 1000 heures et plus de formation pour vous accompagner et réaliser vos défis, ambitions et aspirations.",sicpnl.org,pnl coaching
